,Unnamed: 0,User_id,Type,Content_id,Url,Reply_to_content_id,Thread_id,Subforum,Title,Content,Timestamp,Search_Term,Matching_Word,Has_Other_Sentiment,Target_Sentence,Sentiment
60,428,757328,Post,['146474207'],https://forums.hardwarezone.com.sg/threads/serious-anyone-got-judged-before-for-cancelling-their-cdac-donations-every-month.6877437/,,6877437,Forums,[Serious] - Anyone got judged before for cancelling their CDAC donations every month?,"feel like cancelling, $3 every month can buy one packet of simple cai png, plus i don't know where my money is going to. what does edmw think? according to cdac latest financial statements: cdac audited report fy 2021 read cdac audited report fy 2021 by cdac on issuu and browse thousands of other publications on our platform. start here! issuu.com 20% of employees earn 100k and more on top of that, key management compensation amounts to more than 600k!!!!!!",2023/2/27 22:04,cdac,TRUE,FALSE, what does edmw think? according to $T$ latest financial statements: cdac audited report fy 2021 read cdac audited report fy 2021 by cdac on issuu and browse thousands of other publications on our platform,0
5,16,815074,Post,['145992640'],https://forums.hardwarezone.com.sg/threads/can-cdac-directors-oyk-sun-xl-koh-pk-chee-hong-tat-baey-yk-explain-why-pay-20-staff-100k-per-annum-paid-wif-1-donations-from-almost-all-sinkies.6866152/,,6866152,Forums,"Can CDAC directors OYK, Sun XL, Koh PK, Chee Hong Tat, Baey YK explain why pay 20 staff >$100k per annum paid wif$1 donations from almost all Sinkies?",cdac audited report fy 2021 read cdac audited report fy 2021 by cdac on issuu and browse thousands of other publications on our platform. start here! issuu.com thought cdac is to help the poor? how does paying $100k to the staff help the poor? and they get hundreds of thousands of sinkies to donate $1 each month to them by default? they collect 50 cents to a dollar from low income workers to pay their key staff $100-300k each year? thanks to @balian for highlighting.,2023/1/27 0:43,cdac,TRUE,FALSE,cdac audited report fy 2021 read $T$ audited report fy 2021 by cdac on issuu and browse thousands of other publications on our platform,0
57,428,757328,Post,['146474207'],https://forums.hardwarezone.com.sg/threads/serious-anyone-got-judged-before-for-cancelling-their-cdac-donations-every-month.6877437/,,6877437,Forums,[Serious] - Anyone got judged before for cancelling their CDAC donations every month?,"feel like cancelling, $3 every month can buy one packet of simple cai png, plus i don't know where my money is going to. what does edmw think? according to cdac latest financial statements: cdac audited report fy 2021 read cdac audited report fy 2021 by cdac on issuu and browse thousands of other publications on our platform. start here! issuu.com 20% of employees earn 100k and more on top of that, key management compensation amounts to more than 600k!!!!!!",2023/2/27 22:04,cdac,TRUE,FALSE, what does edmw think? according to $T$ latest financial statements: cdac audited report fy 2021 read cdac audited report fy 2021 by cdac on issuu and browse thousands of other publications on our platform,0
13,63,204542,Post,['146298050'],https://forums.hardwarezone.com.sg/threads/a-financial-burden-higher-cpf-salary-ceiling-will-add-to-businesses-woes-say-associations-and-experts.6873291/,,,Forums,,"singapore: the raising of the central provident fund (cpf) monthly salary ceiling will add to the woes of companies already grappling with increasing costs, said business associations and experts. while the phased increase by 2026 can help soothe the impact, some smaller firms will still feel an additional  financial burden , they added. the ceiling sets out the maximum amount of ordinary wages that can be used to compute cpf contributions. an example of an  ordinary wage  would be a monthly salary. this is currently set at s$6,000 and will go up in four stages to s$8,000 by 2026, as announced by deputy prime minister lawrence wong in his budget speech on tuesday (feb 14). the first increase to s$6,300 will kick in on sep 1 this year, before the next hike to s$6,800 in 2024. it will be raised again to s$7,400 in 2025 before reaching s$8,000 in 2026. the cpf annual salary ceiling, which takes into account additional wages such as a performance bonus, remains at s$102,000. currently, employees aged up to 55 years old contribute 20 per cent of their wages to their cpf, while employers contribute 17 per cent. the rise in the monthly salary ceiling essentially means that workers who earn more than s$6,000   and their employers   will have to contribute more to their cpf. the singapore business federation (sbf), which represents 27,000 companies, said the move will add to businesses' manpower costs. the pressures on this front are already piling up with the rise in foreign worker levies, local qualifying salaries and wage adjustments under the progressive wage model, it said.  sbf urges the government to consider spacing out some of these wage and manpower-related policies to help businesses survive immediate cost challenges,  said mr albert tsui, executive director of the federation's advocacy and policy division. beyond labour costs, businesses have also been paying more in other aspects of their operations ranging from logistics, raw materials to energy, said professor sumit agarwal from the national university of singapore (nus).  will this change cause a burden on employers? clearly it will because it s a tough time with rising costs and economic uncertainties,  said the professor of finance, economics and real estate at the nus business school. some businesses may have to pass on these costs to consumers, he added. deloitte singapore s tax partner yap hsien yew described the announcement as possibly being  a financial burden  for businesses, especially small- and medium-size enterprises (smes) which may not have the same access to cash flow and healthy profits as larger corporations. beyond financial metrics, the impact on smes will also differ depending on the industry. those that employ more higher-income workers will feel the heat, said the association of small and medium enterprises (asme). this group will likely involve smes in industries such as technology and professional services such as accounting and auditing.  in other sectors like retail, most of the workers employed by smes are between the salary range of s$2,500 to $$4,000, which means they will not be affected in the near term,  said the association's vice-president ang yuit. phased increase to cushion impact   the phased increase in the cpf monthly salary ceiling will help cushion the impact on employers, both asme and the singapore national employers federation (snef) said. this will allow employers to ""gradually adjust and factor this increase"" into their business costs against the backdrop of slower economic growth, rising costs and a tight labour market, added snef, which has more than 3,400 members. the cpf annual salary ceiling has also been left unchanged for now, said prof agarwal, noting that this will also mitigate the impact on businesses. mr christopher gee, a senior research fellow and head of the governance and economy department at the institute of policy studies, estimates that the change in the monthly salary ceiling, when fully implemented by 2026, will result in an increase of s$2 billion to s$2.5 billion in labour costs annually . this increase would need to be offset by productivity gains to ensure it is sustainable for businesses and their workers in the long run, he wrote in a commentary. deloitte's mr yap said employers should view the announcement as helping to build a more financially secure workforce, which ultimately benefits them in the long run.  while the increase may be a financial burden in the short term, it is an investment that businesses should consider in order to reap the long-term benefits of having a financially secure and experienced workforce,  he told cna. it was also announced in budget 2023 that the government will continue with the next increase in cpf contribution rates for older workers , following the first two steps of increases in 2022 and 2023. from next year, the total cpf contribution rates for workers aged 56 to 60 and 61 to 65 will go up by 1.5 percentage points to 31 per cent and 22 per cent, respectively. the contribution rate for workers aged 66 to 70 will rise by 1 percentage point to 16.5 per cent. to mitigate the rise in business costs, employers will get a one-year offset that is equivalent to half of the 2024 increase in employer contribution rates for every singaporean and permanent resident they employ aged 56 to 70. 'a financial burden': higher cpf salary ceiling will add to businesses' woes, say associations and experts the increase in the cpf salary ceiling means that those who earn more than s$6,000   and their employers   will soon have to contribute more towards their retirement savings. www.channelnewsasia.com",2023/2/16 10:42,central provident fund,TRUE,FALSE,"singapore: the raising of the $T$ (cpf) monthly salary ceiling will add to the woes of companies already grappling with increasing costs, said business associations and experts",-1
22,198,338874,Post,['146597589'],https://forums.hardwarezone.com.sg/threads/cpf-to-close-300-000-accounts-of-non-citizens-non-permanent-residents-from-april-2024.6880253,,6880253,Forums,"CPF to close 300,000 accounts of non-citizens, non-permanent residents from April 2024","cpf to close 300,000 accounts of non-citizens, non-permanent residents from april 2024  https://www.businesstimes.com.sg/singapore/cpf-close-300000-accounts-non-citizens-non-permanent-residents-april-2024 about 300,000 central provident fund (cpf) accounts belonging to non-singapore citizens and non-permanent residents will be automatically closed from apr 1, 2024. the cpf board on wednesday (mar 8) noted that most of these accounts have low balances, with more than two-thirds of the accounts holding less than s$5,000 each. owners of these accounts have received contributions from employers, or made voluntary contributions before 2003. they also include former singapore citizens and permanent residents who have since relinquished their citizenship or permanent residency status. account owners will have up until mar 31, 2024, to transfer their cpf savings to their personal bank accounts. remaining savings can still be transferred at any time after the accounts  automatic closures on apr 1, 2024, but will cease to earn the prevailing cpf interest rate. non-singapore citizen/permanent resident employees who wish to continue saving in singapore may consider options such as the supplementary retirement scheme, or other relevant commercial investment products, said the cpf board. the automatic closure of cpf accounts for all non-singapore citizens and permanent residents in 2024 comes as the  final step in ensuring that the cpf system focuses on its core objective of catering to the retirement, housing and healthcare needs of (existing) singapore citizens and permanent residents , said the cpf board.  the purpose of the cpf system is to help singapore citizens and permanent residents retire with a peace of mind. in line with this, cpf members who are not singapore citizens and permanent residents will have to close their cpf accounts.  prior to 1987, cpf contributions were mandatory for all employees working in singapore   including those who did not have singapore citizen and permanent resident status. the requirement was dropped in 1987, but non-singapore citizen/permanent resident employees working in singapore on work permits could opt to contribute to their cpf accounts on a voluntary basis. this was extended to non-singapore citizen/permanent resident employees working in singapore on all types of work passes, and not just work permit holders, from 1995. non-singapore citizen/permanent resident employees were disallowed from making voluntary contributions to their cpf accounts from 2003. previously, the cpf board told the business times that singapore citizens and permanent residents renouncing their citizenship or residency statuses were  strongly encouraged  to close their cpf accounts, as these members had no intention of retiring in singapore.",2023/3/8 12:29,central provident fund,TRUE,FALSE,"sg/singapore/cpf-close-300000-accounts-non-citizens-non-permanent-residents-april-2024 about 300,000 $T$ (cpf) accounts belonging to non-singapore citizens and non-permanent residents will be automatically closed from apr 1, 2024",0
126,683,338874,Post,['146597589'],https://forums.hardwarezone.com.sg/threads/cpf-to-close-300-000-accounts-of-non-citizens-non-permanent-residents-from-april-2024.6880253,,6880253,Forums,"CPF to close 300,000 accounts of non-citizens, non-permanent residents from April 2024","cpf to close 300,000 accounts of non-citizens, non-permanent residents from april 2024  https://www.businesstimes.com.sg/singapore/cpf-close-300000-accounts-non-citizens-non-permanent-residents-april-2024 about 300,000 central provident fund (cpf) accounts belonging to non-singapore citizens and non-permanent residents will be automatically closed from apr 1, 2024. the cpf board on wednesday (mar 8) noted that most of these accounts have low balances, with more than two-thirds of the accounts holding less than s$5,000 each. owners of these accounts have received contributions from employers, or made voluntary contributions before 2003. they also include former singapore citizens and permanent residents who have since relinquished their citizenship or permanent residency status. account owners will have up until mar 31, 2024, to transfer their cpf savings to their personal bank accounts. remaining savings can still be transferred at any time after the accounts  automatic closures on apr 1, 2024, but will cease to earn the prevailing cpf interest rate. non-singapore citizen/permanent resident employees who wish to continue saving in singapore may consider options such as the supplementary retirement scheme, or other relevant commercial investment products, said the cpf board. the automatic closure of cpf accounts for all non-singapore citizens and permanent residents in 2024 comes as the  final step in ensuring that the cpf system focuses on its core objective of catering to the retirement, housing and healthcare needs of (existing) singapore citizens and permanent residents , said the cpf board.  the purpose of the cpf system is to help singapore citizens and permanent residents retire with a peace of mind. in line with this, cpf members who are not singapore citizens and permanent residents will have to close their cpf accounts.  prior to 1987, cpf contributions were mandatory for all employees working in singapore   including those who did not have singapore citizen and permanent resident status. the requirement was dropped in 1987, but non-singapore citizen/permanent resident employees working in singapore on work permits could opt to contribute to their cpf accounts on a voluntary basis. this was extended to non-singapore citizen/permanent resident employees working in singapore on all types of work passes, and not just work permit holders, from 1995. non-singapore citizen/permanent resident employees were disallowed from making voluntary contributions to their cpf accounts from 2003. previously, the cpf board told the business times that singapore citizens and permanent residents renouncing their citizenship or residency statuses were  strongly encouraged  to close their cpf accounts, as these members had no intention of retiring in singapore.",2023/3/8 12:29,cpf,TRUE,FALSE," the automatic closure of $T$ accounts for all non-singapore citizens and permanent residents in 2024 comes as the  final step in ensuring that the cpf system focuses on its core objective of catering to the retirement, housing and healthcare needs of (existing) singapore citizens and permanent residents , said the cpf board",0
35,252,293209,Post,['144810416'],https://forums.hardwarezone.com.sg/threads/ocbc-offers-fixed-deposit-placements-for-cpf-ordinary-account-savings-at-3-4-a-year.6836093/,,6836093,Forums,OCBC offers fixed deposit placements for CPF ordinary account savings at 3.4% a year,https://www.businesstimes.com.sg/banking-finance/ocbc-offers-fixed-deposit-placements-for-cpf-ordinary-account-savings-at-34-a-year,2022/11/16 12:17,cpf,TRUE,FALSE,sg/banking-finance/ocbc-offers-fixed-deposit-placements-for-$T$-ordinary-account-savings-at-34-a-year,0
227,63,204542,Post,['146298050'],https://forums.hardwarezone.com.sg/threads/a-financial-burden-higher-cpf-salary-ceiling-will-add-to-businesses-woes-say-associations-and-experts.6873291/,,,Forums,,"singapore: the raising of the central provident fund (cpf) monthly salary ceiling will add to the woes of companies already grappling with increasing costs, said business associations and experts. while the phased increase by 2026 can help soothe the impact, some smaller firms will still feel an additional  financial burden , they added. the ceiling sets out the maximum amount of ordinary wages that can be used to compute cpf contributions. an example of an  ordinary wage  would be a monthly salary. this is currently set at s$6,000 and will go up in four stages to s$8,000 by 2026, as announced by deputy prime minister lawrence wong in his budget speech on tuesday (feb 14). the first increase to s$6,300 will kick in on sep 1 this year, before the next hike to s$6,800 in 2024. it will be raised again to s$7,400 in 2025 before reaching s$8,000 in 2026. the cpf annual salary ceiling, which takes into account additional wages such as a performance bonus, remains at s$102,000. currently, employees aged up to 55 years old contribute 20 per cent of their wages to their cpf, while employers contribute 17 per cent. the rise in the monthly salary ceiling essentially means that workers who earn more than s$6,000   and their employers   will have to contribute more to their cpf. the singapore business federation (sbf), which represents 27,000 companies, said the move will add to businesses' manpower costs. the pressures on this front are already piling up with the rise in foreign worker levies, local qualifying salaries and wage adjustments under the progressive wage model, it said.  sbf urges the government to consider spacing out some of these wage and manpower-related policies to help businesses survive immediate cost challenges,  said mr albert tsui, executive director of the federation's advocacy and policy division. beyond labour costs, businesses have also been paying more in other aspects of their operations ranging from logistics, raw materials to energy, said professor sumit agarwal from the national university of singapore (nus).  will this change cause a burden on employers? clearly it will because it s a tough time with rising costs and economic uncertainties,  said the professor of finance, economics and real estate at the nus business school. some businesses may have to pass on these costs to consumers, he added. deloitte singapore s tax partner yap hsien yew described the announcement as possibly being  a financial burden  for businesses, especially small- and medium-size enterprises (smes) which may not have the same access to cash flow and healthy profits as larger corporations. beyond financial metrics, the impact on smes will also differ depending on the industry. those that employ more higher-income workers will feel the heat, said the association of small and medium enterprises (asme). this group will likely involve smes in industries such as technology and professional services such as accounting and auditing.  in other sectors like retail, most of the workers employed by smes are between the salary range of s$2,500 to $$4,000, which means they will not be affected in the near term,  said the association's vice-president ang yuit. phased increase to cushion impact   the phased increase in the cpf monthly salary ceiling will help cushion the impact on employers, both asme and the singapore national employers federation (snef) said. this will allow employers to ""gradually adjust and factor this increase"" into their business costs against the backdrop of slower economic growth, rising costs and a tight labour market, added snef, which has more than 3,400 members. the cpf annual salary ceiling has also been left unchanged for now, said prof agarwal, noting that this will also mitigate the impact on businesses. mr christopher gee, a senior research fellow and head of the governance and economy department at the institute of policy studies, estimates that the change in the monthly salary ceiling, when fully implemented by 2026, will result in an increase of s$2 billion to s$2.5 billion in labour costs annually . this increase would need to be offset by productivity gains to ensure it is sustainable for businesses and their workers in the long run, he wrote in a commentary. deloitte's mr yap said employers should view the announcement as helping to build a more financially secure workforce, which ultimately benefits them in the long run.  while the increase may be a financial burden in the short term, it is an investment that businesses should consider in order to reap the long-term benefits of having a financially secure and experienced workforce,  he told cna. it was also announced in budget 2023 that the government will continue with the next increase in cpf contribution rates for older workers , following the first two steps of increases in 2022 and 2023. from next year, the total cpf contribution rates for workers aged 56 to 60 and 61 to 65 will go up by 1.5 percentage points to 31 per cent and 22 per cent, respectively. the contribution rate for workers aged 66 to 70 will rise by 1 percentage point to 16.5 per cent. to mitigate the rise in business costs, employers will get a one-year offset that is equivalent to half of the 2024 increase in employer contribution rates for every singaporean and permanent resident they employ aged 56 to 70. 'a financial burden': higher cpf salary ceiling will add to businesses' woes, say associations and experts the increase in the cpf salary ceiling means that those who earn more than s$6,000   and their employers   will soon have to contribute more towards their retirement savings. www.channelnewsasia.com",2023/2/16 10:42,cpf,TRUE,TRUE," it was also announced in budget 2023 that the government will continue with the next increase in $T$ contribution rates for older workers , following the first two steps of increases in 2022 and 2023",0
41,299,692655,Post,['145585321'],https://forums.hardwarezone.com.sg/threads/cpf-account-value-thread-2023.6856110,,6856110,Forums,CPF Account Value Thread 2023,it's time to showoff your cpf account value. with pictures.,2023/1/1 3:25,cpf,TRUE,FALSE,it's time to showoff your $T$ account value,1
