,Unnamed: 0,User_id,Type,Content_id,Url,Reply_to_content_id,Thread_id,Subforum,Title,Content,Timestamp,Search_Term,Matching_Word,Has_Other_Sentiment,Target_Sentence,Sentiment
134,683,338874,Post,['146597589'],https://forums.hardwarezone.com.sg/threads/cpf-to-close-300-000-accounts-of-non-citizens-non-permanent-residents-from-april-2024.6880253,,6880253,Forums,"CPF to close 300,000 accounts of non-citizens, non-permanent residents from April 2024","cpf to close 300,000 accounts of non-citizens, non-permanent residents from april 2024  https://www.businesstimes.com.sg/singapore/cpf-close-300000-accounts-non-citizens-non-permanent-residents-april-2024 about 300,000 central provident fund (cpf) accounts belonging to non-singapore citizens and non-permanent residents will be automatically closed from apr 1, 2024. the cpf board on wednesday (mar 8) noted that most of these accounts have low balances, with more than two-thirds of the accounts holding less than s$5,000 each. owners of these accounts have received contributions from employers, or made voluntary contributions before 2003. they also include former singapore citizens and permanent residents who have since relinquished their citizenship or permanent residency status. account owners will have up until mar 31, 2024, to transfer their cpf savings to their personal bank accounts. remaining savings can still be transferred at any time after the accounts  automatic closures on apr 1, 2024, but will cease to earn the prevailing cpf interest rate. non-singapore citizen/permanent resident employees who wish to continue saving in singapore may consider options such as the supplementary retirement scheme, or other relevant commercial investment products, said the cpf board. the automatic closure of cpf accounts for all non-singapore citizens and permanent residents in 2024 comes as the  final step in ensuring that the cpf system focuses on its core objective of catering to the retirement, housing and healthcare needs of (existing) singapore citizens and permanent residents , said the cpf board.  the purpose of the cpf system is to help singapore citizens and permanent residents retire with a peace of mind. in line with this, cpf members who are not singapore citizens and permanent residents will have to close their cpf accounts.  prior to 1987, cpf contributions were mandatory for all employees working in singapore   including those who did not have singapore citizen and permanent resident status. the requirement was dropped in 1987, but non-singapore citizen/permanent resident employees working in singapore on work permits could opt to contribute to their cpf accounts on a voluntary basis. this was extended to non-singapore citizen/permanent resident employees working in singapore on all types of work passes, and not just work permit holders, from 1995. non-singapore citizen/permanent resident employees were disallowed from making voluntary contributions to their cpf accounts from 2003. previously, the cpf board told the business times that singapore citizens and permanent residents renouncing their citizenship or residency statuses were  strongly encouraged  to close their cpf accounts, as these members had no intention of retiring in singapore.",2023/3/8 12:29,cpf,TRUE,FALSE, non-singapore citizen/permanent resident employees were disallowed from making voluntary contributions to their $T$ accounts from 2003,0
237,425,492144,Post,['139474856'],https://forums.hardwarezone.com.sg/threads/how-retiree-in-singapore-saved-over-1-6m-in-her-cpf.6686519/,,6686519,Forums,How retiree in Singapore saved over $1.6m in her CPF,"a 67-year-old retiree holds a record of sorts that most of us would yearn for - she has more than $1.2 million in her ordinary account (oa) of the central provident fund (cpf). if that's not impressive enough, she has another $400,000 in her retirement account and over $50,000 in her medisave account. please subscribe or log in  to continue reading the full article. how retiree in singapore saved over $1.6m in her cpf these savings allow her to enjoy close to $50,000 in annual interest from the cpf alone.  read more at straitstimes.com. www.straitstimes.com",2022/1/28 13:43,cpf,TRUE,TRUE,2 million in her ordinary account (oa) of the central provident fund ($T$),0
201,940,15040,Post,['124548495'],https://forums.hardwarezone.com.sg/threads/transfer-cpf-to-spouse-or-to-child.6180429/,,6180429,Forums,"Transfer CPF to Spouse, or to Child?","i have already maxed out my cpf special account and medisave account. i still have a nice sum in my oa that i am considering transferring either to (a) my spouse, or (b) my children. i am seeking views on what you think is the better option here. we have no intention of buying new property / moving house in the near or medium term. hence, the usage of cpf oa will be very limited. my children are still very young - the eldest is 3yo. my wife's cpf sa still has a sizeable headroom before the frs is hit. what would you consider to be the better option in my circumstances?",2020/1/10 14:27,cpf,TRUE,FALSE," hence, the usage of $T$ oa will be very limited",0
254,690,338874,Post,['130617975'],https://forums.hardwarezone.com.sg/threads/medishield-life-premium-increases-driven-by-rise-in-payouts-and-more-claimants-says-koh-poh-koon.6403730/,,6403730,Forums,"MediShield Life premium increases driven by rise in payouts and more claimants, says Koh Poh Koon","medishield life premium increases driven by rise in payouts and more claimants, says koh poh koon https://www.channelnewsasia.com/new...payouts-claimants-increased-premiums-13441178 singapore: the proposed hike in medishield life premiums is driven by three factors, including an increase in annual payouts and the number of claimants, said senior minister of state for health koh poh koon in parliament on monday (nov 2). he was responding to questions by several members of parliament from the people s action party (pap), workers  party (wp) and progress singapore party (psp) about the government's justification for increasing premiums, the schemes available to help those who cannot afford it, as well as the rise in hospital charges. the medishield life council had announced in september several recommendations to enhance medishield life benefits and adjust premiums upwards by up to 35 per cent for some. it is the first major review of the national insurance scheme since it was introduced in 2015. giving a breakdown of the figures, dr koh said that over the last four years, the number of medishield claimants increased by about 30 per cent and annual payouts went up by about 40 per cent. between 2001 and 2019, average hospitalisation bills for public healthcare institutions increased by about 6 per cent a year on average, affected by medical cost inflation, demographics and medical advancements over the years, he added. ""this growth in utilisation and payout accounts for about two-thirds of the premium increases,"" he told the house. one-quarter of the premium increase comes from  refreshing  the claim limits of medishield life, while the remaining portion, just under 10 per cent,  supports the benefit enhancements , including those implemented since 2018. these include the extension of coverage to include inpatient hospices and serious pregnancy complications.  premiums have been kept unchanged for the first five years of medishield life, in line with our earlier public commitment. they need to be adjusted to ensure that the medishield life fund remains solvent and sustainable so that it can meet its obligations to all policyholders,  said dr koh. responding to a question from psp non-constituency mp leong mun wai on whether it is unusual by international standards for a health insurance scheme to increase its premiums by 35 per cent in a single adjustment, dr koh said it would not be appropriate to compare with other schemes as premiums are priced based on multiple factors  which inevitably vary from country to country . ""it would also not be meaningful to compute how much premiums a singaporean will need to pay over his lifetime simply by assuming a fixed compounding factor each year,"" said dr koh.  future premiums would depend on how the underlying drivers   evolve, and this depends on many factors including what we can achieve together to manage healthcare costs. the amount of premium subsidies an individual will receive will also vary over his lifetime, depending on his financial circumstances.  keeping premiums affordable financial support schemes are available to ensure that all singaporeans can continue to pay their premiums, said dr koh. for instance, lower- and middle-income households, as well as seniors from the merdeka generation and pioneer generation will receive premium subsidies and support.  taken together, about 35 per cent of the total premiums collected were paid for by the government through various subsidies and support schemes in 2019. for the elderly aged 65 and above, the contribution from the government is even higher, at about 50 per cent of their premiums,  he said. singaporeans can use medisave to pay for their premiums in full, and they can also use their medisave to pay for their family members  premiums as well. those who still require more help can apply for additional premium support, including those who are mid-way through medical treatment or who have recently lost their jobs and part of their income. the additional premium support will cover all outstanding and future premiums, said dr koh. in addition, singaporeans will receive a covid-19 subsidy for the next two years, which will  pay for the bulk of the premium increase in the first year , said dr koh. he noted that the government had considered deferring the medishield life review and the premium increases due to the current  difficult economic situation  with covid-19.  however, i must emphasise that it was important that medishield life remains solvent and sustainable so that it can meet its obligations in time to come when policyholders make claims. its coverage also has to be updated and enhanced to remain relevant to the healthcare needs of singaporeans,  he said. part of premiums set aside for future touching on the medishield life fund, dr koh said a portion of premiums paid by working adults is set aside to provide for future premium rebates, which will help to moderate premium increases as people age. ""this constitutes the bulk of future commitments set aside in the reserves. as the majority of policyholders are relatively young today, the amount set aside has been increasing,"" he said. dr koh added that other such commitments include diseases currently under treatment that will require long-term care, such as renal failure and cancer. providing figures in parliament, dr koh said a total of s$7.5 billion in premiums were collected between 2016 and 2019. this comprised s$4.4 billion collected from policyholders, and s$3.1 billion from the government in terms of subsidies and other forms of premium support. in this same period, s$3.5 billion in claims were paid out, while s$3 billion was set aside for future premium rebates. the incurred loss ratio of the fund was an average of 104 per cent over the period from 2016 to 2019. ""this means that the total premiums collected were slightly less than the total monies required to ensure that the fund is able to meet current claims and future commitments,"" said dr koh. he stressed that the fund has to be  self-sustaining  and based on  sound actuarial principles . ""premiums collected have to cover potential current and future payouts, including amounts set aside to support future commitments as well as provide a buffer against unforeseen contingencies such as unexpected spikes in hospitalizations due to disease outbreaks,"" he added. computing premium increases several mps raised questions relating to how premium increases are computed. in response to pap mp foo mee har s question on whether the ministry of health would  itemise  factors contributing to the premium increase, dr koh said that it is difficult to predict the technology driving clinical practice. in the past, a head injury would only warrant an x-ray of the skull, which costs about s$15 to s$20. but now, barely 20 years later, ct scans are required for head injuries, which can cost  hundreds of dollars , he said.  so as opposed to a transport fair formula where the parameters and variables are a little bit more fixed and more predictable, healthcare inflation takes into account many unforeseen kind of variables that will come along the way,  he said. while it will be hard to have a single formula with  that level of clarity , actuaries that use current data to project will make adjustments over time, and this is why the government has to review premiums on a regular basis, he added. wp mp gerald giam reiterated his question on whether the government would make the full medishield life actuarial report available, for the sake of transparency. dr koh said medishield life premiums are proposed and calculated by external actuaries who are independent from the government. the size of the funds, the amount collected and the amount paid out are also externally audited and the report will later be submitted to parliament on an annual basis, he added. however, dr koh acknowledged that the government may have to have a  better system  of looking at how the assumptions and calculations need to evolve.  over time, we could perhaps engage different consultants to take a look, to challenge the assumptions, to do another calculation at an appropriate time, to make sure that we are still on track,  he said. he added that ministry would speak to consultants on publishing some of the data  in an academic way , but emphasised that it will  not be something that most laypeople will understand .",2020/11/2 20:27,health insurance,TRUE,TRUE," responding to a question from psp non-constituency mp leong mun wai on whether it is unusual by international standards for a $T$ scheme to increase its premiums by 35 per cent in a single adjustment, dr koh said it would not be appropriate to compare with other schemes as premiums are priced based on multiple factors  which inevitably vary from country to country ",0
33,241,584439,Post,['146249637'],https://forums.hardwarezone.com.sg/threads/high-income-low-wealth-over-half-of-adults-in-singapore-dont-watch-their-spending.6872117/,,6872117,Forums,"High income, low wealth: Over half of adults in Singapore don’t watch their spending","anyone got full article? high income, low wealth: over half of adults in singapore don t watch their spending it is a myth that people with high income are automatically smart with their money. read more at straitstimes.com. www.straitstimes.com",2023/2/13 6:37,high income,TRUE,FALSE,"anyone got full article? high income, low wealth: over half of adults in singapore don t watch their spending it is a myth that people with $T$ are automatically smart with their money",-1
18,157,786710,Post,['133617985'],https://forums.hardwarezone.com.sg/threads/no-of-sporean-men-who-are-less-educated-have-difficulty-finding-a-local-wife-has-shrunk-smu-prof.6501056,,6501056,Forums,"No. of S'porean men who are less educated, have difficulty finding a local wife has shrunk: SMU Prof","commenting on the changing profile of nr brides, professor paulin straughan, a sociologist at singapore management university, said: ""we now see a transformation of transnational marriages. ""when we first started looking at this phenomenon, it was way back in the late 1990s and 2000s when we saw the inflow of foreign brides. ""when we mentioned foreign brides (in the past), we thought of women with low socio-economic status from the region who enter into marriages because of their families' financial circumstances."" but she said that the demographic profile has changed over the past 20 years, with economic growth in the region bringing greater educational and economic opportunities in their home countries. prof straughan said the result is that foreign wives are better educated. separately, the number of singaporean men who are less educated and who may have difficulties finding a local wife has shrunk, she added. social workers have long raised concerns over transnational marriages involving older and less educated singaporean men marrying young foreign women after a brief courtship. foreign brides who marry s'poreans are getting older and more educated: msf data two in three have post-secondary or university education, according to government data released for the first time. read more at straitstimes.com. www.straitstimes.com",2021/4/22 7:55,less educated,TRUE,FALSE," separately, the number of singaporean men who are $T$ and who may have difficulties finding a local wife has shrunk, she added",1
19,157,786710,Post,['133617985'],https://forums.hardwarezone.com.sg/threads/no-of-sporean-men-who-are-less-educated-have-difficulty-finding-a-local-wife-has-shrunk-smu-prof.6501056,,6501056,Forums,"No. of S'porean men who are less educated, have difficulty finding a local wife has shrunk: SMU Prof","commenting on the changing profile of nr brides, professor paulin straughan, a sociologist at singapore management university, said: ""we now see a transformation of transnational marriages. ""when we first started looking at this phenomenon, it was way back in the late 1990s and 2000s when we saw the inflow of foreign brides. ""when we mentioned foreign brides (in the past), we thought of women with low socio-economic status from the region who enter into marriages because of their families' financial circumstances."" but she said that the demographic profile has changed over the past 20 years, with economic growth in the region bringing greater educational and economic opportunities in their home countries. prof straughan said the result is that foreign wives are better educated. separately, the number of singaporean men who are less educated and who may have difficulties finding a local wife has shrunk, she added. social workers have long raised concerns over transnational marriages involving older and less educated singaporean men marrying young foreign women after a brief courtship. foreign brides who marry s'poreans are getting older and more educated: msf data two in three have post-secondary or university education, according to government data released for the first time. read more at straitstimes.com. www.straitstimes.com",2021/4/22 7:55,less educated,TRUE,FALSE, social workers have long raised concerns over transnational marriages involving older and $T$ singaporean men marrying young foreign women after a brief courtship,-1
27,220,338874,Post,['146405416'],https://forums.hardwarezone.com.sg/threads/commentary-singapore-residents-must-save-for-retirement-today-to-continue-enjoying-low-income-taxes.6875787/,,,Forums,,"commentary: singapore residents must save for retirement today to continue enjoying low income taxes  for direct taxes to remain low, singapore workers need to do more with their money to prepare for their future retirement, says david kuo of the smart investor. commentary: singapore residents must save for retirement today to continue enjoying low income taxes for direct taxes to remain low, singapore workers need to do more with their money to prepare for their future retirement, says david kuo of the smart investor. www.channelnewsasia.com singapore: the message from the budget 2023 speech could not have been clearer. it cannot be business as usual for singapore. over the last couple of decades, the country has benefited from global trade and finance flows. but with increased patriotism, protectionism and nationalism swirling around the world, singapore will have to work even harder to maintain its competitiveness. as the economy matures, retirement is an area that we should pay attention to. by 2030, which is just seven short years away, one in four singaporeans will be aged 65 or above, up from one in five. budget 2023 offers targeted support to singapore s growing pool of seniors . the eldercare fund will be topped up by s$500 million, and another s$1.5 billion will be added to the medifund. but just think about that for a moment. singapore expects a budget deficit of s$2 billion in the financial year (fy) of 2022, and a deficit of s$400 million in fy2023. those deficits would be almost erased if not for the subsidies provided to the elderly. that is another way of saying that there are no free lunches. if we want direct taxes to remain low, then we must be prepared to make provisions for our retirement, so we won t need government subsidies. ensuring our retirement adequacy  as singapore studies how else it can help seniors in community settings , there is plenty that singapore workers can do for themselves now. while the government has kept the rate of contributions to the central provident fund (cpf) unchanged, it will raise the monthly salary ceiling from s$6,000 to s$8,000 to reflect the rise in wages as a result of inflation . but this alone may not be enough for an ideal retirement for some individuals. if so, they will need to do more with their money to enjoy their twilight years. perhaps the single most important question we need to ask ourselves is how much money we realistically need to retire. this number varies greatly based on your needs and lifestyle. a 2019 lee kuan yew school of public policy study estimated that the minimum amount a senior needs for a basic standard of living in singapore is about s$1,400 a month. but considering that the median income per household member in singapore is about s$3,200 a month, which adds up to s$38,400 per year, let s work off a round figure of s$50,000 as the amount needed each retirement year. you can scale this up or down accordingly, but don t forget to factor in inflation. at an annual inflation rate of, say, 3 per cent, our s$50,000 target would be equivalent to s$100,000 in around 24 years  time. and in 48 years  time, it would need to be as much as $200,000. that, by the way, is not how much money we would need to have in our retirement pot. that is the income we would need to generate from our savings. because we don t know how long we will live, we do not want to draw down the pot and run the risk of exhausting it. taking into account the 4 per cent floor interest rate of the cpf special account , the nest egg required to generate an annual income of s$100,000 a year in 24 years  time is s$2.5 million. we should ask ourselves if our accumulated cpf contributions earning 2.5 per cent interest a year will be able to grow sufficiently to reach that target. if it is unlikely, we should invest some of our money into assets that can outpace the rate of rising prices. that generally means investing in shares. there is a limit as to how much our cpf money can be invested in the stock market. so, we may need to look beyond compulsory contributions and build another pot of money outside of cpf. the best time to do that is while we are young. indirect taxes prevail over direct taxes  budget 2023 also highlighted the government s commitment to low personal income tax with indirect taxes taking the brunt. stamp duties on high-end properties will rise. so too will taxes on luxury cars . we can argue about the benefits of indirect taxes versus direct taxes. in the case of the former, we pay taxes as we spend. in the case of the latter, the decision to spend is taken away from us through taxation. however, taxes on expensive cars and properties are unlikely to affect the mass affluent. the upshot is that raising taxes on these items can be a good way for the government to redistribute wealth. after all, that is one of the main reasons why we pay taxes. it is a means by which some wealth from those can afford it can be transferred to those who need it. setting aside money for the next crisis  there was another important message in the budget. while the pandemic has been funded by a necessary deficit, budgets must always be balanced over a business cycle. though singapore will not draw on its reserves in this year s budget, past deficits must eventually be replaced by future surpluses. what s more, singapore must continue to consciously build up its reserves to prepare for the next crisis. we need to do the same too. the government has provided singaporeans with the means to cope with inflationary pressures through voucher schemes . this should help ease some of the pain when we do our daily shopping. more importantly, it buys us time to set aside some money for a rainy day because wages are rising but income tax rates aren t. it is a window of opportunity that other developed economies have been unable to provide. but we need to fix our roofs when the sun is shining. it will be too late when thunderstorms hit. in summary, budget 2023 puts households firmly in the driving seat. the government is treating people as mature adults in a maturing economy. the country s finances are strong and should be even stronger over time. we too can make our household finances stronger over time by being prudent with our spending and preparing for future uncertainties. if we want our taxes to remain low, we need to do our part to ensure that it stays that way. david kuo is co-founder of the smart investor.",2023/2/23 9:09,low income,TRUE,FALSE," commentary: singapore residents must save for retirement today to continue enjoying $T$ taxes for direct taxes to remain low, singapore workers need to do more with their money to prepare for their future retirement, says david kuo of the smart investor",0
