,Unnamed: 0,User_id,Type,Content_id,Url,Reply_to_content_id,Thread_id,Subforum,Title,Content,Timestamp,Search_Term,Matching_Word,Has_Other_Sentiment,Target_Sentence,Sentiment
192,938,338874,Post,['146537023'],https://forums.hardwarezone.com.sg/threads/scholars-and-farmers-whats-the-state-of-meritocracy-in-singapores-workplaces.6878896/,,,Forums,," scholars  and  farmers : what s the state of meritocracy in singapore s workplaces?  do scholars get fast-tracked to the top? has society allocated too much reward for those with exam-passing ability? the series measuring meritocracy asks how we can value skills mastery and accord more workers decent pay.  scholars  and  farmers : what s the state of meritocracy in singapore s workplaces? do scholars get fast-tracked to the top? has society allocated too much reward for those with exam-passing ability? the series measuring meritocracy asks how we can value skills mastery and accord more workers decent pay. www.channelnewsasia.com singapore: his mother was a cleaner, and mohamed hannifa now works to empower people in her industry. as a service engineer at lionsbot international, which makes cleaning robots, the 28-year-old teaches cleaners how to use and maintain the company s robots. he has also been sent abroad to train technicians and dealers.  he s very adaptable,  enthused lionsbot chief executive officer dylan ng terntzer.  he s willing to put in the hours   the hours of travelling on the road, the hours of support over the phone, late into the night.  and he s able to take the stress of facing customers when, sometimes, things don t go well. so all this helps to mature him and (take his work to) a different level.  seeing his mother return home with body aches over the years made hannifa feel he should do something  meaningful and help her ease her burdens . robots can take over tasks such as floor cleaning, which could make up about 60 per cent of the daily work, allowing cleaners to  focus on the finer points of cleaning , like high dusting, disinfecting and customer service, said ng.  they can do more tasks. because of that, they can command higher pay. the cleaner is the supervisor of all these robots, deciding the schedule, the workloads,  he added. hannifa, who has a diploma in mechatronics engineering, never thought he would end up in customer service. after joining lionsbot nearly two years ago, however,  i started loving my job , he said.  once you find your area of interest, stay there, work hard and start growing.  what has also grown in recent years is discussion on what meritocracy means in singapore s workplaces. the series measuring meritocracy examines the impact of trends such as a growing proportion of workers wielding degrees and asks how society can value skills mastery and accord more workers decent pay. watch: meritocracy at work in singapore   how relevant is it today? (45:51) number of cleaners is shrinking  cleaners remain among the lowest-paid workers in singapore, despite governmental support for uplifting their wages and roles. but there is something people may not know about the profession.  the secret is, there aren t many cleaners left,  said ng. there were about 55,000 cleaners in singapore as at november, of whom 41,200 were citizens and permanent residents, according to the national environment agency. a decade ago, the reported number of cleaners here was 70,000. cleaners are also becoming higher skilled   in several years, they may become more like facility professionals who have been trained in security and landscaping besides cleaning, ng reckoned. they would all be assisted by technology and robots, he said.  the aspirations of the young have risen, and we must meet their aspirations,  he said.  they re not just doing a cleaner s job, but they re more of a robot operator. in this way, they might feel more empowered,  said hannifa. they could become more tech-savvy in other areas of their lives in the process, he added.  resentful and alienated people   although many jobs such as cleaning do not require a degree and remain essential to society, the salary gap between graduates and non-graduates has grown. the median pay of university graduates is now more than twice that of institute of technical education (ite) graduates. between 2016 and 2021, the median starting salary gap between the two groups grew by s$300 , while that between degree and diploma holders grew by s$200.  we ve allocated too much reward and prestige to just one form of human aptitude   the kind of exam-passing ability that some people have,  said david goodhart, author of the book  head, hand, heart: the struggle for dignity and status in the 21st century .  that has unbalanced our societies in some ways.  the proportion of job vacancies in singapore open only to applicants with degrees is increasing, which has been observed in many advanced economies, said sahara sadik, assistant director of research at the institute of adult learning. commenting on the trend in britain, goodhart said:  this is completely the wrong direction. we ve overshot in the production of academic skills, and we ve undervalued many of the functions that are absolutely vital for a good society.  this creates two groups of  resentful and alienated people : those who do not go to university at all and people who do but do not get the  elite professional jobs  they had hoped for, he said. those without degrees feel undervalued in society; this creates a political problem that has been  one of the drivers of populist politics , he added. calling england an  extreme instance of a meritocratically bifurcated society , yale law school professor daniel markovits cited the  populist uprising  seen in brexit, the united kingdom s exit from the european union.  people with elaborate elite educations wanted to stay in the eu. people without those educations wanted to leave.  in the united states, the election of former president donald trump  tells exactly the same story , said markovits, author of the book  the meritocracy trap . given these developments, it is important that singapore remains an  open, inclusive society where social mobility is alive and possible, even for those who start out as very poor in life , said institute of policy studies deputy director (research) gillian koh. middle-class wages without  elaborate degrees ?  yet, some shortcomings of meritocracy   where advancement and economic rewards should be the result of talent or effort, instead of family background or connections   are clear even before one enters the workforce. parents who have achieved positions of advantage  mobilise their social networks  to help their children secure valuable internships, opportunities that would not be open to students who are the first in their family to graduate from university, said koh.  so can we think about how meritocracy needs to be complemented by other methods and programmes so that these kids gather the right work experience (and) useful contacts, so that when they finally graduate, they have as much chance (to get good jobs)?  a solution, said markovits, is to restructure the labour market so that people do not require  elaborate university degrees  to be able to get good jobs. the europeans are  very good  at traditional trades and guilds,  so that you can, in germany, have a very good job as a glazier or an electrician or a plumber .  an ordinary person can t walk   off the street and already know how to do it,  said markovits. these are crafts done by people who have had  serious training  but not degrees,  and they re paid middle-class wages . in singapore, such roles could be in nursing, for example, or port operations. while more nurses now have bachelor s and even postgraduate degrees, singapore general hospital advanced practice nurse tan hui li said nurses without a degree  can still do their job well .  besides the education, caring and doing it (well) comes with experience,  she said. over at port operator psa, service engineer syed muhammad fayyadh recently earned his work-study diploma in port automation technology. the course introduced him to software and new technologies that can apply to automated guided vehicles   skills in line with future port operations.",2023/3/4 8:27,meritocracy,TRUE,FALSE,  scholars  and  farmers : what s the state of $T$ in singapore s workplaces? do scholars get fast-tracked to the top? has society allocated too much reward for those with exam-passing ability? the series measuring meritocracy asks how we can value skills mastery and accord more workers decent pay,0
54,396,757328,Post,['146509937'],https://forums.hardwarezone.com.sg/threads/here-are-my-reasons-to-be-grateful-for-pap.6878244/,,6878244,Forums,Here are my reasons to be grateful for PAP,"1) signing many good ftas like ceca which in turn brings about good jobs for singaporeans. don't believe? just walk along cpb and mbfc during lunch time and see how many happy singaporean faces there are. 2) encouraging singaporeans to upskill: every year we have $500 credits to become computer engineers, accountants, it experts or even the next elon musk. which govt in the world is this nice to their own citizens? 3) increasing gst in times of inflation so that more citizens can get gst vouchers. we can also help the poor more by paying more gst. each time i see my restaurant bill inclusive of 8% gst, it brings a smile to my face. 4) affordable housing, so popular until btos are always oversubscribed. 5) giving singaporean males the privilege to serve ns and defend our spgs, new citizens, fts and maybe locals. 6) meritocracy where everyone has a chance to progress and definitely not due to any relations. thank you pap!! feel free to add your reasons and be grateful what does edmw think?",2023/3/2 12:13,meritocracy,TRUE,FALSE, 6) $T$ where everyone has a chance to progress and definitely not due to any relations,1
194,938,338874,Post,['146537023'],https://forums.hardwarezone.com.sg/threads/scholars-and-farmers-whats-the-state-of-meritocracy-in-singapores-workplaces.6878896/,,,Forums,," scholars  and  farmers : what s the state of meritocracy in singapore s workplaces?  do scholars get fast-tracked to the top? has society allocated too much reward for those with exam-passing ability? the series measuring meritocracy asks how we can value skills mastery and accord more workers decent pay.  scholars  and  farmers : what s the state of meritocracy in singapore s workplaces? do scholars get fast-tracked to the top? has society allocated too much reward for those with exam-passing ability? the series measuring meritocracy asks how we can value skills mastery and accord more workers decent pay. www.channelnewsasia.com singapore: his mother was a cleaner, and mohamed hannifa now works to empower people in her industry. as a service engineer at lionsbot international, which makes cleaning robots, the 28-year-old teaches cleaners how to use and maintain the company s robots. he has also been sent abroad to train technicians and dealers.  he s very adaptable,  enthused lionsbot chief executive officer dylan ng terntzer.  he s willing to put in the hours   the hours of travelling on the road, the hours of support over the phone, late into the night.  and he s able to take the stress of facing customers when, sometimes, things don t go well. so all this helps to mature him and (take his work to) a different level.  seeing his mother return home with body aches over the years made hannifa feel he should do something  meaningful and help her ease her burdens . robots can take over tasks such as floor cleaning, which could make up about 60 per cent of the daily work, allowing cleaners to  focus on the finer points of cleaning , like high dusting, disinfecting and customer service, said ng.  they can do more tasks. because of that, they can command higher pay. the cleaner is the supervisor of all these robots, deciding the schedule, the workloads,  he added. hannifa, who has a diploma in mechatronics engineering, never thought he would end up in customer service. after joining lionsbot nearly two years ago, however,  i started loving my job , he said.  once you find your area of interest, stay there, work hard and start growing.  what has also grown in recent years is discussion on what meritocracy means in singapore s workplaces. the series measuring meritocracy examines the impact of trends such as a growing proportion of workers wielding degrees and asks how society can value skills mastery and accord more workers decent pay. watch: meritocracy at work in singapore   how relevant is it today? (45:51) number of cleaners is shrinking  cleaners remain among the lowest-paid workers in singapore, despite governmental support for uplifting their wages and roles. but there is something people may not know about the profession.  the secret is, there aren t many cleaners left,  said ng. there were about 55,000 cleaners in singapore as at november, of whom 41,200 were citizens and permanent residents, according to the national environment agency. a decade ago, the reported number of cleaners here was 70,000. cleaners are also becoming higher skilled   in several years, they may become more like facility professionals who have been trained in security and landscaping besides cleaning, ng reckoned. they would all be assisted by technology and robots, he said.  the aspirations of the young have risen, and we must meet their aspirations,  he said.  they re not just doing a cleaner s job, but they re more of a robot operator. in this way, they might feel more empowered,  said hannifa. they could become more tech-savvy in other areas of their lives in the process, he added.  resentful and alienated people   although many jobs such as cleaning do not require a degree and remain essential to society, the salary gap between graduates and non-graduates has grown. the median pay of university graduates is now more than twice that of institute of technical education (ite) graduates. between 2016 and 2021, the median starting salary gap between the two groups grew by s$300 , while that between degree and diploma holders grew by s$200.  we ve allocated too much reward and prestige to just one form of human aptitude   the kind of exam-passing ability that some people have,  said david goodhart, author of the book  head, hand, heart: the struggle for dignity and status in the 21st century .  that has unbalanced our societies in some ways.  the proportion of job vacancies in singapore open only to applicants with degrees is increasing, which has been observed in many advanced economies, said sahara sadik, assistant director of research at the institute of adult learning. commenting on the trend in britain, goodhart said:  this is completely the wrong direction. we ve overshot in the production of academic skills, and we ve undervalued many of the functions that are absolutely vital for a good society.  this creates two groups of  resentful and alienated people : those who do not go to university at all and people who do but do not get the  elite professional jobs  they had hoped for, he said. those without degrees feel undervalued in society; this creates a political problem that has been  one of the drivers of populist politics , he added. calling england an  extreme instance of a meritocratically bifurcated society , yale law school professor daniel markovits cited the  populist uprising  seen in brexit, the united kingdom s exit from the european union.  people with elaborate elite educations wanted to stay in the eu. people without those educations wanted to leave.  in the united states, the election of former president donald trump  tells exactly the same story , said markovits, author of the book  the meritocracy trap . given these developments, it is important that singapore remains an  open, inclusive society where social mobility is alive and possible, even for those who start out as very poor in life , said institute of policy studies deputy director (research) gillian koh. middle-class wages without  elaborate degrees ?  yet, some shortcomings of meritocracy   where advancement and economic rewards should be the result of talent or effort, instead of family background or connections   are clear even before one enters the workforce. parents who have achieved positions of advantage  mobilise their social networks  to help their children secure valuable internships, opportunities that would not be open to students who are the first in their family to graduate from university, said koh.  so can we think about how meritocracy needs to be complemented by other methods and programmes so that these kids gather the right work experience (and) useful contacts, so that when they finally graduate, they have as much chance (to get good jobs)?  a solution, said markovits, is to restructure the labour market so that people do not require  elaborate university degrees  to be able to get good jobs. the europeans are  very good  at traditional trades and guilds,  so that you can, in germany, have a very good job as a glazier or an electrician or a plumber .  an ordinary person can t walk   off the street and already know how to do it,  said markovits. these are crafts done by people who have had  serious training  but not degrees,  and they re paid middle-class wages . in singapore, such roles could be in nursing, for example, or port operations. while more nurses now have bachelor s and even postgraduate degrees, singapore general hospital advanced practice nurse tan hui li said nurses without a degree  can still do their job well .  besides the education, caring and doing it (well) comes with experience,  she said. over at port operator psa, service engineer syed muhammad fayyadh recently earned his work-study diploma in port automation technology. the course introduced him to software and new technologies that can apply to automated guided vehicles   skills in line with future port operations.",2023/3/4 8:27,meritocracy,TRUE,FALSE,  what has also grown in recent years is discussion on what $T$ means in singapore s workplaces,0
175,764,631326,Post,['145093107'],https://forums.hardwarezone.com.sg/threads/what-is-meritocracy.6843261/,,6843261,Forums,What is meritocracy?,"is this an example of meritocracy? a foreigner who wants to escape the common prosperity push in his country, shift his wealth out his wealth has nothing to do with singapore at the first place his wealth is here to acquire multiple properties, often freehold his kids go into international schools here he can buy multiple cars and bid up coe prices and reduces quota for locals to drive is this meritocracy?? i'm confused.",2022/12/3 9:14,meritocracy,TRUE,FALSE,"is this an example of $T$? a foreigner who wants to escape the common prosperity push in his country, shift his wealth out his wealth has nothing to do with singapore at the first place his wealth is here to acquire multiple properties, often freehold his kids go into international schools here he can buy multiple cars and bid up coe prices and reduces quota for locals to drive is this meritocracy?? i'm confused",-1
156,702,204542,Post,['135605529'],https://forums.hardwarezone.com.sg/threads/singaporeans-shouldnt-rely-too-much-on-government-to-solve-problems-mas-chief.6566600,,6566600,Forums,Singaporeans shouldn’t rely too much on Government to solve problems: MAS chief,"for society to mature, singaporeans shouldn t rely too much on government to solve problems: mas chief  an overreliance on a government breeds a society that won t survive a bad government, mas chief ravi menon said people across various segments of society must step up to solve problems or improve systems some groups are already doing that but that means more diverse views and public debate people must get used to this, because it is a sign of a maturing society to be an inspiring nation is one underpinned by values and mr menon proposed five for singapore singapore   having a good government is singapore's greatest strength but also its greatest vulnerability, because it is a single point of failure, the country s central bank chief said. mr ravi menon, managing director of the monetary authority of singapore (mas), was speaking at a lecture on wednesday (july 28).  we depend too much on the government to solve our problems.  for a small young country, good government is critical. we don t have the ballast that many larger countries with long histories and deep traditions have to survive bad government,  he added. to face challenges ahead, singapore must forge various sources of strength across different segments of society, he said. that includes its citizenry, business and philanthropic communities, civil society, academia and the media. rising property prices a key driver in wealth inequality, ills of  hereditary meritocracy  exist: ravi menon mr menon was giving the last of a four-part lecture series organised by the institute of policy studies (ips), a think tank under the lee kuan yew school of public policy. the first, where he talked about  hereditary meritocracy  in society, was held early this month. his views were expressed in his capacity as ips  ninth sr nathan fellow. the fellowship was launched in late 2012 to advance research on public policy and governance issues.  a thousand points of light  dr yaacob ibrahim, former minister for communications and information who was an audience member, asked mr menon what changes he would first like to see in singapore. his reply was that too often in singapore, initiatives are led by the government when it is the organisations or the people involved that would understand how best to improve systems or solve a problem. two-thirds of singaporeans wary of trusting other people: ips report  there are some initiatives where it s the private and the public sector together. the government does 70 per cent of the work, has pretty much decided what it wants, but wants some embellishments and enhancements and the reality check,  mr menon added.  i think that model is shifting.  he cited the example of singapore's private banking industry group, which includes more than a dozen major banks, in coming up with standards to lower the risk of money laundering.",2021/7/29 12:09,meritocracy,TRUE,FALSE," rising property prices a key driver in wealth inequality, ills of  hereditary $T$  exist: ravi menon mr menon was giving the last of a four-part lecture series organised by the institute of policy studies (ips), a think tank under the lee kuan yew school of public policy",0
25,204,789953,Post,['146280696'],https://forums.hardwarezone.com.sg/threads/what-is-considered-middle-class-in-sg.6872918,,6872918,Forums,What is considered middle class in SG?,sgd 4-5k salary considered middle class?,2023/2/15 8:13,middle class,TRUE,FALSE,sgd 4-5k salary considered $T$?,0
149,692,705995,Post,['143838225'],https://forums.hardwarezone.com.sg/threads/what-is-middle-class-upper-middle-class-income.6809953/,,6809953,Forums,"What is middle class, upper middle class income","was hearing the debate on increasing tax for the high income earner. what is actually upper middle class income? i tried to google it but nothing to be found what is high income? what is middle class income? if i based on the revised personal income tax rate 1m is top bracket, and 500k come 2nd so meaning to said 500k and above is top income earner 320k is upper middle class income? anything below that middle class income ? all these are individual income bracket",2022/9/16 10:37,middle class,TRUE,FALSE," what is actually upper $T$ income? i tried to google it but nothing to be found what is high income? what is middle class income? if i based on the revised personal income tax rate 1m is top bracket, and 500k come 2nd so meaning to said 500k and above is top income earner 320k is upper middle class income? anything below that middle class income ? all these are individual income bracket",0
